{
  "schema_version": "compute.run-stats/v1",
  "run_ref": "run-example-1",
  "workspace_key": "project:project-example",
  "site_id": "site-a",
  "source": "slurm_sstat",
  "queried_at": "2030-01-01T00:06:02Z",
  "status": "not_running",
  "read_started_at": null,
  "read_finished_at": null,
  "sampled_at": null,
  "execution": null,
  "steps": []
}
